question_number,statement,question_a,question_b,question_c,question_d,question_e,source,answer
10,"O culto a Nossa Senhora Aparecida começou em outubro de 1717, na cidade de Guaratinguetá, no Vale do 
Paraíba paulista. Foi no rio Paraíba do Sul que a santa apareceu, primeiro o corpo, depois a cabeça, nas 
redes de pescadores locais. Na segunda metade do século XIX, a princesa Isabel, uma de suas devotas 
mais famosas, mandou confeccionar uma coroa de ouro e um manto de veludo azul escuro, bordado 
com vinte e um brilhantes que representavam a capital e as vinte províncias do Império. Nossa Senhora 
Aparecida foi proclamada padroeira do Brasil em 1930, após um decreto do papa Pio XI. Em 1980, o dia 
12 de outubro passou a ser feriado oficial no Brasil.
Conforme as informações do texto, é correto afirmar que a devoção a Nossa Senhora Aparecida","foi trazida ao país pela princesa Isabel, herdeira da família imperial, que presenteou a santa com uma 
coroa de ouro e um manto de veludo azul escuro","marca a divisão de classes presente na sociedade brasileira na medida em que está restrita aos 
representantes das classes baixas","foi imposta pelos poderes político e religioso, por meio de decretos papais e projetos de lei, embora 
não tivesse apelo popular","é um fenômeno inexpressivo na história do Brasil, tendo sido ignorada pelas autoridades desde o 
período colonial","iniciou-se no Brasil colônia, atravessou o período imperial e se manteve viva na República",Vestibulinho 2SEM2023,E
11,"Segundo a Resolução nº 001/86 do Conselho 
Nacional do Meio Ambiente (CONAMA), impacto 
ambiental é qualquer alteração das propriedades 
físicas, químicas e biológicas do meio ambiente, 
causada por qualquer forma de matéria ou 
energia resultante das atividades humanas que 
afetem diretamente ou indiretamente: a saúde, 
a segurança, e o bem-estar da população; as 
atividades sociais e econômicas; a biota; as 
condições estéticas e sanitárias ambientais; e 
a qualidade dos recursos ambientais. Esses 
impactos podem ser positivos ou não.
Assinale a alternativa que apresenta ações que 
impactam positivamente o meio ambiente.","A recuperação de áreas degradadas e o 
esgotamento dos recursos naturais","A destruição da camada de ozônio e a 
utilização de energia eólica","A utilização de produtos biodegradáveis e a 
reciclagem de materiais","A potencialização do efeito estufa e a 
modificação de habitat","A diminuição de mananciais e a extinção de 
espécies",Vestibulinho 2SEM2023,C
12,"Leia o cartum.
De acordo com o cartum, o aprimoramento 
do intelecto pressupõe que o indivíduo",deite e procrastine,saia de sua zona de conforto,tenha empatia para com o próximo,conte com a causalidade do destino,"alimente-se de forma saudável e 
pratique atividades físicas",Vestibulinho 2SEM2023,B
13,"não só vacinas contra vírus e bactérias, mas 
também diversos tipos de soros contra os venenos 
de animais peçonhentos a partir da imunização de 
cavalos com antígenos de vários tipos diferentes 
de toxinas.
A Companhia Ambiental do Estado de São Paulo 
(CETESB) é a agência do Governo do Estado 
responsável pelo controle, pela fiscalização, pelo 
monitoramento e pelo licenciamento de atividades 
geradoras de poluição. 
Em relação à qualidade do ar, há monitoramento 
automático para a avaliação de SO2, de material 
particulado inalável (MP10), de ozônio (O3), de 
óxidos de nitrogênio (NO e NO2 – NOx), de 
monóxido de carbono (CO) e de hidrocarbonetos 
não-metânicos (NMHC); além disso, monitoram-
se os parâmetros meteorológicos, como direção e 
velocidade do vento, temperatura e umidade relativa 
do ar.
A partir das informações apresentadas no texto, 
pode-se concluir corretamente que","SO2, formado por átomos de 3 elementos químicos","O3, formado por 3 átomos de 1 elemento químico","NO2, formado por átomos de 3 elementos químicos","NO e o NO2, que diferem por 1 elemento químico","CO, que, diferentemente do CO2, é formado por 2 
elementos químicos",Vestibulinho 2SEM2023,B
14,"Uma das atrações turísticas da ilha de São 
Vicente, no estado de São Paulo, é a Ponte 
Pênsil localizada entre os morros do Japuí e 
dos Barbosas. Ela é responsável pela ligação 
da ilha ao continente e é considerada um marco 
na construção desse tipo de ponte no Brasil.
No final do século XIX, um surto de peste bubônica 
tomou conta da cidade paulista de Santos. Essa 
peste é uma doença de origem bacteriana, causada 
pela bactéria Yersinia pestis, cuja transmissão ao ser 
humano ocorre por pulgas que parasitam animais de 
pequeno porte (em especial, ratos).
Em 1910, a Comissão de Saneamento de 
Santos, liderada pelo engenheiro sanitarista 
Saturnino de Brito, sugeriu a construção da 
ponte com o propósito de servir de suporte à 
instalação de uma tubulação a fim de conduzir o 
esgoto coletado nas cidades de Santos e de São 
Vicente para lançamento no Oceano Atlântico, 
na Ponta de Itaipu, localizada na cidade de Praia 
Grande. Os canais de Santos também fizeram 
parte deste plano de saneamento. Boa parte da 
população da região, no início do século XX, era 
vítima de doenças ocasionadas pela ausência 
de saneamento básico, como febre amarela, 
cólera, leptospirose e peste bubônica.
Por causa disso, surgiu em São Paulo um centro de 
pesquisas, atualmente conhecido pelos brasileiros 
como Instituto Butantan. Este, naquele período, iniciou 
uma grande campanha de saneamento, de combate 
aos ratos e de produção do soro antipestoso para ser 
injetado nas pessoas contaminadas a fim de controlar 
o surto da peste.
Em pouco tempo, o Instituto Butantan ampliou seu 
escopo de atuação no estudo e na prevenção de 
doenças comuns no Brasil, tais como cólera, febre 
amarela, verminoses, tuberculose, poliomielite e 
muitas outras enfermidades, além de atuar também 
no combate a envenenamentos por animais e plantas.
A ponte foi inaugurada em 21 de maio de 1914.
Atualmente, o Instituto Butantan desenvolve estudos 
e pesquisas orientados para a saúde pública, produz
De acordo com o texto, é correto afirmar que","permaneceu como capital do Brasil e uma 
das cidades mais importantes do mundo, 
sendo o principal centro de missionação 
católica e destacando-se por sua arquitetura 
arrojada","o médico Saturnino de Brito construiu a Ponte 
Pênsil, que liga Santos a São Vicente, com o 
propósito de eliminar o vírus que causava a 
peste bubônica","a Ponte Pênsil foi construída para sustentar 
os 
encanamentos 
responsáveis 
pelo 
carregamento do esgoto colhido nas cidades 
de São Vicente e de Santos","a usina hidrelétrica de Itaipu, em São 
Vicente, foi a responsável pela construção da 
Ponte Pênsil, encarregada de enviar água 
para movimentar suas turbinas","os municípios do Japuí e dos Barbosas 
passaram a ter uma ligação terrestre por 
meio da Ponte Pênsil, pois, anteriormente, 
a ligação entre eles era realizada por 
intermédio de barcos.
O texto faz referência ao período histórico em 
que a cidade de São Paulo",Vestibulinho 2SEM2023,E
15,,,,,,,Vestibulinho 2SEM2023,C
16,"Entre as décadas de 1940 e 1950, a cidade 
de São Paulo era servida por duas indústrias 
cerâmicas principais. Um dos produtos dessas 
cerâmicas era uma lajota quadrada, produzida 
nas cores vermelha, amarela e preta.
(B) foi visitada por Mem de Sá, governador- 
-geral do Brasil, que ordenou a transferência 
da população da vila de Santo André da 
Borda do Campo para os arredores do 
colégio, denominado “Colégio de São Paulo 
de Piratininga”.
No processo industrial, aconteciam muitas 
quebras e esse material quebrado era enterrado 
em grandes buracos.
Nessa época, os terrenos dos operários na 
Grande São Paulo tinham área para jardim e 
quintal, que eram revestidos com cimentado 
porque os operários não tinham dinheiro para 
comprar lajotas cerâmicas. Mas um dia, um dos 
empregados de uma das cerâmicas lembrou-se 
do refugo da fábrica e pediu parte do material 
para usar em sua nova casa. A moda de 
pavimentar os quintais com caquinhos, como 
em mosaicos, “pegou” em toda a região 
metropolitana de São Paulo, inclusive nas 
casas de classe média.
(C) consolidou-se como metrópole industrial, 
concentrando o parque industrial brasileiro 
na capital e em sua região metropolitana, 
principalmente a partir da década de 
1950, com a chegada das indústrias 
automobilísticas.
(D) permaneceu como uma vila pobre e isolada 
do litoral, sendo a única vila no interior do 
Brasil, mantendo-se por meio de lavouras 
de subsistência cultivadas por mulheres e 
crianças.
A história termina nos anos 1960 com o 
surgimento dos prédios em condomínio. 
A classe média que usava esse caquinho foi 
para os prédios e a classe operária passou a 
ter terrenos menores ou foi morar em favelas.
(E) vivenciou a expansão da produção do café, 
inicialmente na região da Avenida Paulista 
e depois nas regiões de Cidade Ademar, 
Santo Amaro, Butantã, Morumbi e Casa 
Verde.",,,,,,Vestibulinho 2SEM2023,C
17,"Leia os textos para responder 
às questões 19 e 20.
O litoral de São Paulo possui cerca de 
880 km de extensão de linha de costa e abrange 
16 municípios. Ele é banhado pelo Oceano 
Atlântico, cuja água apresenta densidade média 
de 1,03 g/cm3.
Lenda do Peixe Tapa
Andava São Pedro passeando pelas 
praias de Ilhabela, em São Paulo, quando, 
preocupado com a maré, perguntou ao 
linguado: “a maré enche ou vaza?”.
Considere que densidade (d) é a razão entre 
a massa (m) e o volume (V) de uma amostra:
 .
O linguado, em vez de responder direito, 
imitou São Pedro com voz fanhosa e boca 
torta.
d 
V
m
Então, São Pedro deu-lhe um tapa e lhe 
falou: “com os olhos para trás hás de ficar”.
Quando coletarmos 1 kg de água do Oceano 
Atlântico, 
necessitaremos 
de 
um 
recipiente 
cujo volume mínimo, em cm3, deverá ser 
aproximadamente de
É por isso que o linguado é chamado de 
peixe tapa, é chato, tem boca torta e os olhos 
“por cima” das costas em um lado só.","1 030,0","103,0","350,0","970,9","97,0",Vestibulinho 2SEM2023,D
18,"O cloreto de sódio é o sal mais abundante nas 
águas do Oceano Atlântico, que também contém 
cloreto de potássio e cloreto de magnésio.
Os sais são formados por cátions (íons positivos) e 
ânions (íons negativos).
Questão 00
Questão 19
Saiba que as representações dos íons presentes 
nos sais citados no texto são:
O linguado é um animal bentônico, que vive sob 
areia e cascalho no fundo do mar, ficando apenas 
com os olhos para fora. Por isso, ele consegue 
visualizar o chão ao seu redor e imitar os locais 
onde vive, mudando sua própria cor.
Cátions: Na+, K+ e Mg2+
Ânion: Cl–
Assinale a alternativa que apresenta a fórmula 
correta para os sais presentes no texto.
Essa importante adaptação do linguado, que lhe 
permite tornar-se praticamente invisível, recebe o 
nome de",protocooperação,"NaCl, KCl, MgCl2","NaCl, KCl, Mg2Cl","ClNa, ClK, Cl2Mg","ClNa, ClK, ClMg",Vestibulinho 2SEM2023,B
20,"Leia os textos para responder 
às questões de 21 a 23.
Na lenda do Peixe Tapa é mencionado o fenômeno 
das marés, que consiste nas variações do nível 
do mar ao longo do dia. Esse fenômeno é uma 
decorrência da atração gravitacional entre a Terra e 
o Sol e, principalmente, entre a Terra e a Lua.
Considerada a maior companhia de saneamento 
do Brasil, a Sabesp foi criada no ano de 1973 
a partir da fusão de seis empresas privadas que 
atuavam na distribuição de água e na coleta de 
esgotos em várias regiões do estado de São 
Paulo.
Considere os quadrinhos.
Nos primeiros anos, a empresa chegou a receber 
a adesão de, em média, oito cidades por mês, 
alcançando rapidamente o patamar de centenas 
de municípios atendidos e conseguindo diminuir, 
cada vez mais, o índice de mortalidade infantil.
Entre as conquistas que marcaram a história 
da Sabesp na década de 1970, estão 
as 
implantações 
do 
Sistema 
Cantareira, 
responsável pelo abastecimento de parcela 
significativa da Região Metropolitana de São 
Paulo, e, nos anos seguintes, dos sistemas 
integrados de distribuição de água e de coleta 
de esgotos.
As estações de tratamento de água (ETAs) da 
Sabesp funcionam como verdadeiras fábricas 
para produzir água potável.
Atualmente, são tratados, aproximadamente, 
120 mil litros de água por segundo.",,,,,,Vestibulinho 2SEM2023,E
21,"De acordo com os textos, é correto afirmar que","marés baixas quando a Lua sai de sua órbita 
para se afastar da Terra","marés altas quando a Lua sai de sua órbita 
para se aproximar da Terra","marés altas nas regiões da Terra em que é dia, 
porque essas regiões estão mais próximas do 
Sol","marés baixas nas regiões da Terra em que 
é noite, porque essas regiões estão mais 
distantes do Sol","marés altas em regiões da Terra que estão 
mais próximas da Lua ao longo do movimento 
de rotação da Terra",Vestibulinho 2SEM2023,C
22,"Suponha que a média de adesão relatada no texto seja mantida e que a Sabesp hoje atenda 375 municípios.
Entre as alternativas dadas, assinale a que apresenta o menor número inteiro que corresponde ao 
tempo necessário, em anos, para a empresa conseguir ultrapassar a adesão de mais da metade desses 
municípios.","1,00","1,25","1,50","1,75","2,00",Vestibulinho 2SEM2023,E
23,"A vazão (z) é a rapidez com que o volume (v) de um determinado fluido escoa ao longo do tempo (t), 
ou seja, .
t
v
z
De acordo com o texto, podemos considerar que a vazão de água potável da Sabesp é de aproximadamente 
1,2 × 105 L/s.
Para determinar o volume tratado em 1 minuto, temos que:
t
v
z
60s
v
→ 1,2 × 105 L/s
→ v = (1,2 × 105 L/s) × 60 s → v = 72 × 105 L = 7,2 × 106 L.
Dessa forma, ao fim de um dia, a Sabesp terá tratado um volume, em litros, de aproximadamente","1,0 × 107","1,0 × 108","1,0 × 109","1,0 × 1010","1,0 × 1011",Vestibulinho 2SEM2023,D
24,"O processo convencional de tratamento de água é dividido em fases que contam com um rígido controle 
de dosagem de produtos químicos e com o acompanhamento dos padrões de qualidade.
Uma dessas fases é a Floculação, que serve para provocar a formação de flocos aglutinando as 
partículas de sujeira. Essa fase é seguida pela Decantação, em que a água passa por grandes tanques 
para separar os flocos de sujeira formados na etapa anterior.
Nessa última etapa, os flocos de sujeira são separados usando uma propriedade específica da matéria 
denominada","ponto de fusão, pois os flocos são fundidos e retirados quando se depositam no fundo dos tanques","ponto de fusão, pois os flocos formam vapores que serão eliminados no ar","solubilidade, pois os flocos são dissolvidos e separados na filtração","solubilidade, pois os flocos formados irão para a superfície dos tanques e serão retirados com 
peneiras","densidade, pois os flocos formados irão para o fundo dos tanques e serão aspirados lentamente",Vestibulinho 2SEM2023,E
25,"da degradação: o trecho morto do rio Tietê 
chegou a 163 km em 2019, aumento de 
33,6% em relação aos 122 km do ano anterior 
e está muito maior que a poluição registrada 
na série histórica (71 km em 2014).
Toda vez que nos alimentamos, resíduos 
ficam depositados em nossos dentes e, se a 
higienização não for realizada corretamente, o 
ambiente bucal fica propício à proliferação de 
bactérias e à formação de placas bacterianas. 
As bactérias degradam os carboidratos dos 
alimentos, 
elas 
produzem 
ácidos 
que 
desmineralizam o esmalte dos dentes, dando 
origem as cáries.
De acordo com o texto, é correto afirmar que","a higiene bucal, quando realizada com 
eficiência diariamente, ocasiona um elevado 
índice de proliferação de bactérias e de 
formação de placas bacterianas","a ação de bactérias na degradação dos 
carboidratos aumenta a acidez bucal, que é 
fundamental para o processo de proteção e 
de mineralização dos dentes","o flúor, adicionado à água potável, atua na 
digestão dos resíduos alimentares que ficam 
na cavidade bucal quando a higienização 
não é realizada corretamente","a 
fluoretação 
da 
água 
aumenta 
a 
desmineralização do esmalte dos dentes, 
reduzindo o aparecimento de cáries, por isso 
é um processo importante na saúde bucal","o flúor é usado na prevenção de cáries, pois 
fortalece o esmalte dos dentes, formando um 
material resistente à acidez decorrente da 
ação de bactérias",Vestibulinho 2SEM2023,E
26,,a anexação do território do Acre,"a vitória do Império do Brasil na Guerra do 
Paraguai","a chegada da Família Real Portuguesa ao 
Rio de Janeiro","o extermínio dos povos indígenas do Planalto 
Paulista","a Proclamação da Independência do Brasil.
Promessa vem, promessa vai. Já são muitos 
anos de juras e sonhos de despoluição do 
Tietê, o maior rio do estado de São Paulo.
A degradação dessa veia aquática começou 
ainda na década de 1940, e, hoje, quem 
passa pelas suas margens tem que tapar 
as narinas. Estudo recém-divulgado pela 
Fundação SOS Mata Atlântica traz o retrato",Vestibulinho 2SEM2023,D
27,"O Museu Paulista da Universidade de São 
Paulo, também conhecido como Museu 
do Ipiranga, é o museu público mais 
antigo da nossa capital, e sua sede é um 
monumento-edifício. É o mais importante 
museu da Universidade de São Paulo 
(USP) e um dos mais visitados da cidade.
O museu foi inaugurado oficialmente em 
7 de setembro de 1895 com o nome 
Museu de História Natural. Atualmente 
caracteriza-se 
como 
uma 
instituição 
científica, cultural e educacional que exerce 
pesquisa, ensino e extensão com atuação 
no campo da História.
O museu apresentado no texto foi fundado para 
celebrar",,,,,,Vestibulinho 2SEM2023,E
28,"No site Inova Educação, do estado de São Paulo, encontramos este infográfico.
De acordo com o infográfico, assinale a alternativa que apresenta, corretamente, uma atividade relacionada 
à pergunta “Como ser um cidadão mais participativo?”.",Trabalhar com carteira assinada como atendente em uma pizzaria,Produzir lanches saudáveis para vender na escola,Ser estagiário remunerado em uma empresa de distribuição de alimentos,Visitar e conversar com pacientes internados em hospitais,Atuar profissionalmente na elaboração de jogos on-line,Vestibulinho 2SEM2023,D
31,"O texto menciona a necessidade de uma obra de infraestrutura para atender à demanda da produção 
de café, que",perdia espaço para o tabaco como principal produto de exportação do Brasil no período mencionado,"era voltado para o mercado interno, consumido principalmente nos estados da região Centro-Oeste","entrava no país pelo porto de Santos, vindo da Etiópia, e era distribuído nos entrepostos e armazéns 
do interior de São Paulo","ocupava posição irrelevante na pauta de exportações brasileiras, sendo consumido em países 
pequenos, como Guiana Francesa e Suriname","era enviado principalmente para os Estados Unidos e para diferentes países da Europa, sendo o 
principal produto de exportação do Brasil",Vestibulinho 2SEM2023,E
32,"No início da década de 1970, eram necessárias aproximadamente 2 horas para realizar o trajeto entre a 
estação Valongo e a estação da Luz. 
Nesse percurso, o trem se locomovia com uma velocidade escalar média, aproximadamente, de","69,5 km/h","54,5 km/h","39,5 km/h","34,5 km/h","24,5 km/h",Vestibulinho 2SEM2023,C
33,"No estado de São Paulo, durante a segunda metade do século XIX, grandes ferrovias foram construídas. 
O principal motivo desse empreendimento foi o escoamento da produção do café até às proximidades do 
porto de Santos.
Atualmente, um dos principais produtos exportados pelo porto de Santos é",semicondutor,óleo de palma,fertilizante,trigo,soja,Vestibulinho 2SEM2023,E
34,"Em 1904, a Companhia Paulista de Estradas de Ferro demonstrou interesse em continuar com seus 
trilhos pela zona da futura Alta Paulista. Adolpho Pinto, engenheiro da Companhia, determinou o 
nome das futuras estações ao longo da linha. Por se tratar de uma linha nova, o engenheiro pode 
dar uma nomenclatura especial para as futuras estações, com as iniciais dos nomes formando um 
abecedário. Cada um dos nomes recordaria vários acontecimentos históricos que marcaram o estado 
de São Paulo. Seguindo essa lógica, os nomes escolhidos por Adolpho Pinto para o Abecedário 
da Paulista foram: América, Brasília, Cabrália, Duartina, Esmeraldas, Fernandina, Gália, Hespéria, 
Italina, Jafa, Kobe, Lácio, Marília, Nipônica, Ormuz, Pompeia, Tupã e Universo. Referências 
históricas presentes nos nomes fazem menção à localização geográfica do país (América Latina) 
e às correntes imigratórias vindas de países como Itália e Japão. Muitos desses nomes foram 
posteriormente mudados, mas a companhia empenhou-se em manter a ideia do abecedário.
Com base no texto, é correto afirmar que","as outras ferrovias paulistas nomeavam suas estações seguindo um padrão estabelecido pelo 
governo federal desde 1808","as outras ferrovias paulistas copiaram o modelo abecedário da Companhia Paulista de Estradas de 
Ferro, utilizado por esta desde o século XVII","a estação Nipônica foi assim nomeada como uma homenagem aos imigrantes japoneses que vieram 
ao Brasil no século XIX para participar da construção de ferrovias","o nome de cada estação da linha citada estava ligado tanto a eventos históricos vinculados ao estado 
de São Paulo quanto a correntes imigratórias e à localização geográfica","o nome das estações coincide com o nome das cidades que se formaram ao seu redor, pois 
elas mantiveram suas denominações e, portanto, não houve trocas de nomes até os dias de hoje",Vestibulinho 2SEM2023,D
35,"Leia os textos
A única revolução possível é a que se faz dentro de nós. Não é possível libertar um povo sem, 
antes, livrar-se da escravidão de si mesmo. Sem esta [revolução interna], qualquer outra será 
insignificante, efêmera e ilusória, quando não um retrocesso. Cada pessoa tem sua caminhada 
própria. Faça o melhor que puder. Seja o melhor que puder. O resultado virá na mesma proporção 
de seu esforço. Compreenda que, se não veio, cumpre a você (a mim e a todos) modificar suas 
(nossas) técnicas, visões, verdades etc. Nossa caminhada somente termina no túmulo. Ou até 
mesmo além… Segue a essência de quem teve sucesso em vencer um império…
GANDHI, Mahatma. A única revolução possível é dentro de nós.
[…] O sentido da vida é tudo aquilo que nos encaminha na direção da realização do nosso projeto. 
Cada vez que você dá um passo […] na direção da consecução do seu projeto, você se realiza 
como pessoa. […] Uma vida sem rumo deve ser como um barco sem bússola, um filme sem roteiro.
Com base nos textos, é correto afirmar que","a realização do nosso projeto de vida passa pelas revoluções industriais, que ajudaremos a construir, 
para que nossa caminhada tenha sentido","o estabelecimento dos próprios caminhos e o esforço para fazer o nosso melhor são ações 
fundamentais para empreender qualquer projeto de vida","um projeto de vida bem estruturado é como um barco sem instrumentos de navegação e sem cinemas 
que nos permitam assistir a filmes sem roteiros previamente traçados","toda revolução é um retrocesso e a única possível é aquela que faz nossa caminhada seguir além do 
túmulo, ou seja, quando transformamos o regime social de nosso país em um império","nossa realização como pessoa necessita de retrocessos para que possamos nos desvencilhar 
de qualquer caminho pré-estabelecido e, assim, construirmos nossos sonhos sem as amarras da 
sociedade",Vestibulinho 2SEM2023,B
36,"Em 1968, o Prof. Dr. Euryclides de Jesus Zerbini, cirurgião cardiologista, realizou no Hospital das Clínicas 
de São Paulo, com sucesso, o primeiro transplante cardíaco em humano no Brasil.
No caso de cardiopatias de alta complexidade, o transplante de coração surge como a forma mais indicada 
para que o paciente volte a ter uma vida com qualidade.
No entanto, apesar de as cardiopatias estarem associadas a alguns fatores que não podem ser modificados, 
como a hereditariedade, o sexo e a idade, outros fatores podem e devem ser modificados pelas mudanças 
no estilo de vida e pelo uso de medicamentos.
Assim, para o paciente que já tem predisposição ou que tem esse tipo de problema, é importante",manter o nível elevado de pressão arterial e deixar de realizar exames preventivos periodicamente,"não só evitar as atividades físicas, como também reduzir o consumo de água ao longo do dia","manter o consumo elevado de sal, e aumentar o consumo de bebida alcoólica","controlar o excesso de peso, e tomar as medicações quando indicadas","comer alimentos ricos em carboidratos, óleos e gorduras; e excluir legumes, verduras e cereais",Vestibulinho 2SEM2023,D
