question_number,statement,question_a,question_b,question_c,question_d,question_e,source,answer
1,"Leia a reportagem.
Entre as vantagens listadas por estudantes, ao optar pelo ensino técnico, estão o tempo de formação mais 
rápido; seu excelente nível de especialização; e a preparação voltada às necessidades do mercado de trabalho. 
Além disso, há o fato de que essa modalidade de educação promove habilidades socioemocionais, como a 
empatia, e também estreita laços com professores.
“São professores que nos levam para escolhas além das nossas vidas”, diz um aluno de uma escola técnica com 
600 alunos matriculados no momento da entrevista. Contudo a luta dos professores, dessa unidade, é contra a 
evasão escolar acentuada pela pandemia da COVID–19.
Suponha que, no momento da entrevista, a unidade escolar mencionada no texto registrava um índice de evasão 
escolar de cerca de 30 % em relação aos alunos matriculados no início do ano letivo.
Logo, o número de alunos matriculados no início do mesmo ano, nessa unidade escolar, era aproximadamente",1 200,1 040,980,860,630,Vestibulinho 1SEM2022,D
2,"O desemprego estrutural é aquele causado pela introdução de novas tecnologias no processo produtivo de uma 
empresa, a fim de reduzir os custos.
O desemprego conjuntural está vinculado às oscilações econômicas de um país: se a economia está aquecida, 
as empresas contratam, diminuindo o desemprego; se a economia não está indo bem, as empresas demitem parte 
de seus funcionários para equilibrar suas contas, aumentando o desemprego.
Sobre os tipos de desemprego citados, podemos afirmar corretamente que","o desemprego estrutural é passageiro, pois quando a economia de um determinado país começa a melhorar 
os empregos retornam e as pessoas se reempregam","o desemprego estrutural está ligado à adoção de novas máquinas e robôs nas empresas que os adotam para 
substituir o trabalho humano","o desemprego conjuntural diminui em tempos de crise econômica e aumenta quando a economia mostra sinais 
de vitalidade",o desemprego conjuntural será zerado quando todas as máquinas e robôs forem destruídos pelos trabalhadores,"o desemprego conjuntural e o desemprego estrutural são sinônimos, pois definem o mesmo tipo de desemprego",Vestibulinho 1SEM2022,B
3,"Os agrônomos e os técnicos em agronomia podem trabalhar no acompanhamento do cultivo e da colheita 
de safras a fim de aumentar a produtividade por meio da seleção de sementes, do emprego de fertilizantes e 
do combate a pragas.
O controle biológico de pragas é uma técnica que cresce com bastante eficiência dentro do meio agrícola 
visando diminuir a necessidade de utilização de agrotóxicos a fim de evitar a contaminação do solo, da água 
e dos próprios seres humanos.
Um exemplo de controle biológico é a utilização de joaninhas, insetos predadores que se alimentam de pulgões 
e cochonilhas, pragas presentes em algumas culturas de hortaliças e árvores frutíferas.
A técnica de controle biológico descrita no texto consiste na","introdução de insetos prejudiciais à agricultura, uma vez que se alimentam de tecido vegetal","aplicação de inseticidas, a fim de diminuir o número de organismos causadores das pragas presentes em culturas 
de hortaliças e de árvores frutíferas","utilização de sementes previamente selecionadas e no emprego de fertilizantes, a fim de expandir as plantações 
de soja e de outras lavouras","utilização de inimigos naturais específicos, como predadores, a fim de combater os organismos causadores 
de danos às plantações","introdução de insetos parasitas na plantação, a fim de impedir que os seres causadores da praga cheguem 
à fase reprodutiva",Vestibulinho 1SEM2022,D
4,"O agrônomo também será responsável pela adubação da área a ser cultivada. 
A quantidade de adubo recomendada é um número expresso na unidade kg/ha (kilograma por hectare).
A adubação é, geralmente, realizada em sulcos, neste caso, transforma-se a quantidade Q de adubo de kg/ha 
para g/m (grama por metro).
Em que: 
Q = quantidade de adubo em kg/ha;
E = espaçamento em metros entre os sulcos (m).
Q . E
10
g/m
Para cada sulco, a fórmula utilizada é:
Veja o exemplo de cálculo da quantidade de adubo, considerando-se a recomendação de 350 kg/ha 
e um espaçamento entre sulcos de 45 cm.
Primeiramente, deve-se fazer a conversão de centímetro para metro: 45 cm = 0,45 m.
Depois, usando a fórmula apresentada, temos, por sulco: = 15,75 g/m.
350 . 0,45
10
g/m
Logo, a quantidade de adubo, para um sulco de 100 m de comprimento será: (15,75 g/m) x 100 m = 1 575 g ou 1,575 kg.
Considere uma recomendação para adubação de 500 kg/ha, sendo o espaçamento entre os sulcos de 60 cm. A massa 
de adubo que deverá ser utilizada, em kg, em um sulco com 150 m de comprimento, é de","3,0","4,5","30,0","450,0","4 500,0",Vestibulinho 1SEM2022,B
5,"Durante dezenas de milhares de anos, os grupos pré-históricos viveram exclusivamente da caça, da pesca 
e da coleta usando armas de pedras talhadas. Para suprir suas necessidades básicas de sobrevivência, eles 
melhoraram técnicas de caça e de pesca, inventaram ferramentas eficientes, descobriram meios para produzir 
e conservar o fogo, aprenderam a reconhecer vegetais comestíveis e ervas curativas, desenvolveram técnicas 
e instrumentos para preparar a pele de animais para roupas e tendas. Tais atividades exigiam planejamento, 
organização, divisão do trabalho, troca de informações – evidências de que os caçadores paleolíticos já tinham 
um modo de vida em sociedade.
DOMINGUES, Joelza Esther. História em documento. Imagem e texto. 6. 2ª edição. São Paulo: FTD, 2013. p.30. Adaptado.
No período abordado pelo texto, os humanos","mostraram-se incapazes de suprir suas necessidades básicas de sobrevivência, o que os fez viver exclusivamente 
da caça, da pesca e da coleta","viviam de forma muito semelhante à dos demais animais, sem desenvolver técnicas capazes de melhorar a vida 
em sociedade","aprenderam a reconhecer e a cultivar vegetais comestíveis e ervas curativas e, consequentemente, desenvolveram 
a agricultura","desconheciam formas de exploração e utilização de recursos naturais, como vegetais comestíveis e ervas curativas","reuniram um conjunto de saberes e técnicas de trabalho e desenvolveram um modo de vida em sociedade.
Leia a letra do rap do Emicida para responder às questões de 06 a 09.
Cada dia é uma chance pra ser melhor que ontem 
O sol prova isso quando cruza o horizonte 
Vira fonte que aquece, ilumina 
Faz igualzinho o olhar da minha menina
Então, sucesso na missão, parceiro, 
É ter paz quando pôr a cabeça no travesseiro
1
Conseguir manter quem te faz bem perto 
Parabéns, mamãe, seu projeto de homem feliz deu certo
15
Outra vez, a esperança na mochila eu ponho 
Quanto tempo a gente ainda tem pra realizar o nosso sonho? 
Não posso me perder não 
Vários trocou sorriso por dim*, hoje tão vagando nas multidão
5
[...]
Deixar o sofrimento lá atrás é quente 
Cê quer saber o sentido da vida? Pra frente 
Tô com a paciência de quem junta latinha 
Focado no que tenho, não no que vou ter ou tinha
[...]
20
Eles não pode me enxergar, quem dirá me entender
Começa outro dia, o trem se desprende, vai 
Cheio de gente que deixou a alegria em stand by**
Eu sei que cada orixá vai me proteger 
Porque minhas rima são oração de coração 
Homenagem a quem volta cansado dentro dos busão
10
Com a essência da rua, no espírito amordaçado 
Quando eles perceber o poder que têm, cuidado!
*dim: redução informal para “dinheiro”.
** stand by: em espera
A cada vento. Intérprete: Emicida. Compositor: Emicida. In: Pra quem 
já mordeu cachorro por comida, até que eu cheguei longe. Intérprete: 
Emicida. [S.l.]: Laboratório Fantasma, 2009. 1 CD, faixa 13",Vestibulinho 1SEM2022,E
6,"No texto apresentado, o eu lírico tece reflexões sobre sua vida e sua realidade.
Algumas delas evidenciam aspectos sociais relevantes, tais como","a garantia da felicidade pelo acúmulo financeiro, como representado no verso 8","a visibilidade social da classe trabalhadora, como representado no verso 9","as vantagens da utilização do transporte público, como representado no verso 12","a busca ininterrupta pela felicidade por meio do consumo constante, como representado no verso 22","o potencial de transformação social das classes desfavorecidas, como representado no verso 24",Vestibulinho 1SEM2022,E
7,"O rap é um estilo musical urbano caracterizado pela declamação ritmada de suas letras. Outra característica marcante 
desse gênero encontra-se na utilização de diferentes níveis de linguagem.
Assinale a alternativa em que todas as palavras pertencem à linguagem coloquial.","ser, ontem, menina, cê","cê, tô, pra, busão","pra, dim, horizonte, esperança","dim, chance, paz, latinha","sol, cruza, mamãe, amordaçado",Vestibulinho 1SEM2022,B
8,"Sobre a passagem “Tô com a paciência de quem junta latinha / Focado no que tenho, não no que vou ter ou tinha”, 
é correto afirmar que o eu lírico","sente-se dividido entre o passado, marcado pela culpa, e o futuro, marcado pelo medo e pelas incertezas","está, apesar das condições sociais, paciente e procura se manter centrado no presente vivenciando cada dia 
isoladamente","encontra-se inquieto diante de suas condições sociais, revendo o passado para não errar no futuro, mas ignorando 
o presente","permanece, durante o seu trabalho, concentrado na realização de suas tarefas para evitar relembrar suas 
experiências passadas","recorre à coleta de materiais recicláveis como metáfora para a imprudência de vivenciar apenas o presente, 
sem se preocupar com o futuro",Vestibulinho 1SEM2022,B
9,"Nos versos 1 e 2, Emicida nos remete ao",amanhecer e a um novo dia com gosto de frustação,amanhecer e à existência de uma nova interrogação,amanhecer e a uma nova oportunidade para sermos melhores,anoitecer e ao arrependimento do dia que se foi,anoitecer e à paralização dos sonhos,Vestibulinho 1SEM2022,C
10,"Considere que um mês tem, em média, uma duração de 4,5 semanas, assim, é correto afirmar que",x > y > z,y > x > z,z > x > y,x > z > y,y > z > x,Vestibulinho 1SEM2022,E
11,"Júnior optou por se mudar para a cidade de Boituva nas proximidades de um centro de treinamento T. 
 
Nessa cidade, ele encontrou algumas opções de imóveis, que denominou A, B, C e D. Além disso, ele descobriu que o 
ruído gerado pelas aeronaves do centro de treinamento podia ser ouvido em uma região com centro em T e raio de 6 km.
Ao representar esses imóveis e o centro de treinamento em um plano cartesiano, cujos eixos têm escalas em 
kilômetros, ele obteve as coordenadas:
T(0,0) A(0,7) B(1,6) C(2,5) D(3,4)
Com base nessas informações, são imóveis que estão fora da zona de ruído",A e B,A e C,A e D,B e C,B e D,Vestibulinho 1SEM2022,A
12,"A origem do fordismo remonta à Segunda Revolução 
Industrial, implementada a partir do final do 
século XIX nos países mais desenvolvidos do 
globo. O avanço da industrialização resultou na 
necessidade da criação de técnicas de produção que 
abrangessem uma qualidade produtiva atrelada à 
rapidez do processo de produção fabril. Portanto, 
foram desenhados modelos de produção industrial 
para a época.
Entre as principais características do sistema de produção mencionado no texto, podemos apontar corretamente","a informatização, a substituição dos trabalhadores por robôs e o consequente aumento dos índices de desemprego","a redução da jornada de trabalho, a ampliação dos direitos trabalhistas e o incentivo ao ócio e à criatividade dos 
trabalhadores","a produção artesanal de mercadorias, realizada em espaços domésticos; e a utilização de mão de obra escravizada, 
proveniente da África","a linha de montagem automatizada, com a utilização de esteiras rolantes; e a especialização produtiva do 
trabalhador, que realizava parte das etapas da produção","a localização das fábricas, que privilegiava a criação de empregos nos países pobres; e o investimento na formação 
do trabalhador, que deveria conhecer todas as etapas do processo produtivo",Vestibulinho 1SEM2022,D
13,"Thomas Robert Malthus foi um economista que em 1798 escreveu um livro denominado Ensaio Sobre a População no 
qual defendia ser o ritmo do crescimento populacional maior que o ritmo do crescimento da produção de alimentos e, 
portanto, faltariam alimentos.
As previsões de Malthus não se concretizaram, pois","a população mundial diminuiu lenta e continuamente, até os dias de hoje e, portanto, a necessidade por alimentos 
também diminuiu no mesmo ritmo","os trabalhadores urbanos, na Revolução Industrial, dividiam seu tempo entre o trabalho em fábricas e em atividades 
ligadas à horticultura, cultivando seu próprio alimento e, dessa forma, acabando com a fome no mundo","novas tecnologias surgiram e foram incorporadas ao processo produtivo nos campos, fazendo aumentar a 
produção de alimentos, em função do desenvolvimento tecnológico proporcionado pela Revolução Industrial","as pessoas se dirigiram em grande quantidade, com o avanço da Revolução Industrial, para as zonas rurais atrás de 
emprego, causando um esvaziamento das cidades e aumentando a produção de gêneros alimentícios nos campos","os proprietários das fábricas, durante a Revolução Industrial, preocupados com a qualidade de vida de seus 
trabalhadores e de suas famílias, criaram um projeto de distribuição de cestas básicas para as famílias de 
trabalhadores sindicalizados, com o intuito de fidelizar a mão de obra",Vestibulinho 1SEM2022,C
14,"Elementos de coesão são palavras e locuções utilizadas dentro de um texto para conectar expressões, orações, 
períodos e parágrafos.
Sobre os elementos coesivos destacados no texto, é correto afirmar que","“para”, no segundo parágrafo, expressa ideia de finalidade, evidenciando o objetivo de um empreendedor 
tradicional, e tem sentido equivalente a “a fim de”","“para”, no terceiro parágrafo, é utilizado para indicar a direção de um projeto social e pode ser substituído pela 
expressão “defronte a”","“porém”, no terceiro parágrafo, expressa ideia de consequência, pois a geração de renda leva à redução de 
desigualdade social, e equivale a “entretanto”","“e”, no terceiro parágrafo, apesar de ser normalmente utilizado para expressar sentido de adição, no texto é 
empregado como oposição, equivalendo a “mas”","“uma vez que”, no quarto parágrafo, corresponde a “porque”, pois explica a eficácia da atuação do empreendedor 
social diante de problemas muito complexos",Vestibulinho 1SEM2022,A
15,"Com base nas informações apresentadas no texto, é correto afirmar que",os conceitos de empreendedorismo estão conectados essencialmente à aquisição de lucro monetário,a fragilidade do serviço social é resultado do financiamento contínuo e da complexidade do problema abordado,"o empreendedorismo social pode ser voltado tanto à melhoria de uma comunidade quanto à obtenção de retorno 
financeiro","os empreendedores sociais privilegiam investimentos em ações nas bolsas de valores, que possibilitam compartilhar 
eventuais prejuízos","o conceito de serviço social é similar ao do empreendedorismo social, pois ambos são ações individuais voltadas à 
formação de agremiações políticas",Vestibulinho 1SEM2022,C
16,"Considere os exemplos:
I Capacitação de produtores familiares do semiárido para o cultivo e a comercialização de produtos orgânicos.
II Construção de sistemas de iluminação utilizando garrafas PET e energia solar disponibilizados a preços acessíveis.
III Organização de campanhas de doação de alimentos e de roupas para vítimas de desastres naturais.
Segundo as definições apresentadas no texto, são exemplos de empreendedorismo social as ações presentes em",I apenas,II apenas,III apenas,I e II apenas,II e III apenas,Vestibulinho 1SEM2022,D
17,"De acordo com o texto, os plásticos são","produzidos diretamente do petróleo, formando pequenas moléculas que serão moldadas",compostos obtidos por reações que usam matéria-prima proveniente do petróleo,macromoléculas com propriedades variadas e não podem ser moldados,estruturas que estão sendo substituídas por outros materiais como o vidro,grandes moléculas que darão origem ao petróleo,Vestibulinho 1SEM2022,B
18,"Os plásticos podem ser moldados, pois “amolecem” com o calor, chegando a sofrer fusão em determinadas temperaturas.
O quadro apresenta o ponto de fusão de alguns tipos de plásticos.
Um 
técnico 
de 
laboratório 
aquece 
separada 
e 
simultaneamente amostras, com massas iguais, de cada 
um dos cinco plásticos do quadro, que estão à mesma 
temperatura inicial.
PLÁSTICO
PONTO DE FUSÃO
PE (polietileno)
220 °C
PET (politereftalato de etileno)
260 °C
O primeiro plástico que sofrerá fusão será o
PP (polipropileno)
160 °C","PS.
PS (poliestireno)
145 °C","PP.
PVC (policloreto de vinila)
115 °C",PE,PET,PVC,Vestibulinho 1SEM2022,E
19,"Em uma usina de reciclagem, os plásticos são separados por diferença de densidade para, posteriormente, serem 
fundidos e remoldados em novos objetos. O quadro apresenta a densidade de alguns plásticos.
Em um tanque com água, colocamos objetos maciços 
confeccionados com os plásticos mencionados.
PLÁSTICO
DENSIDADE
PE (polietileno)
0,92 g/cm3
Os objetos que ficam flutuando na superfície da água são 
confeccionados com
PET (politereftalato de etileno)
1,38 g/cm³
PP (polipropileno)
0,90 g/cm³","PET e PVC.
PS (poliestireno)
1,07 g/cm³","PP e PE.
PVC (policloreto de vinila)
1,40 g/cm³",PS e PVC,"PET, PS e PVC.
Dado: densidade da água = 1,00 g/cm 3","PE, PS e PET",Vestibulinho 1SEM2022,B
20,"De acordo com o texto, é correto afirmar que","as embalagens de latas de flandres, de vidros e de multilaminados vêm substituindo as embalagens PET","os plásticos são amplamente utilizados desde sua descoberta no Brasil, em 1941",o petróleo tem origem nos plásticos que passaram pelo processo de reciclagem,"os plásticos não se deformam, mesmo quando expostos às altas temperaturas",o petróleo é a fonte de diversos tipos de matérias-primas e de combustíveis,Vestibulinho 1SEM2022,E
21,"As latas de flandres, mencionadas no texto, são feitas de uma",mistura revestida de estanho,substância pura revestida de aço,mistura revestida de ferro e carbono,substância composta revestida de ferro,substância simples revestida de estanho,Vestibulinho 1SEM2022,A
22,"Durante a I Guerra Mundial, a economia estadunidense estava em pleno desenvolvimento; suas indústrias 
produziam e exportavam em grandes quantidades, principalmente para os países europeus. No final da década 
de 1920, as nações europeias, recuperando-se dos efeitos negativos da guerra, diminuíram drasticamente a 
importação de produtos industrializados e agrícolas dos Estados Unidos.
Com a diminuição das exportações para a Europa, os estoques das indústrias dos Estados Unidos passaram a 
aumentar, já que essas empresas não conseguiam vender como antes. Grande parte delas tinha ações na Bolsa de 
Valores de Nova Iorque e os milhões de estadunidenses que haviam investido nessas ações correram para tentar 
vendê-las, enquanto seus valores foram caindo gradativamente até o zero.
Essa crise econômica","ficou restrita aos Estados Unidos, pois, no início do século XX, as economias nacionais eram fechadas e, portanto, 
as crises eram localizadas","causou impactos duradouros na economia mundial, abalou os mercados financeiros ao redor do mundo e provocou 
a falência de inúmeras empresas e o desemprego","provocou o aumento da atividade industrial e do emprego nos países africanos, que não foram abalados pela crise 
provocada pelo mercado de ações nos Estados Unidos","demonstrou a força da economia brasileira, que investiu na modernização das lavouras, aumentando a produção e, 
consequentemente, a exportação do café","confirmou a independência dos mercados financeiros, uma vez que foi contornada sem a necessidade de intervenção 
dos governos na economia",Vestibulinho 1SEM2022,B
23,"A pandemia de COVID–19, causada pelo novo coronavírus (SARSCoV–2), evidenciou que desenvolver uma vacina é 
um processo que demanda muita pesquisa e exige um trabalho conjunto de diferentes profissionais da área da 
saúde, tais como médicos, farmacêuticos, biomédicos, engenheiros químicos, entre muitos outros.
Após ser desenvolvida, uma vacina é encaminhada para registro sanitário e, se aprovada pelas agências 
reguladoras, é distribuída para a população.
A produção de uma vacina se baseia no agente causador da doença, o qual estará inativado, atenuado ou 
presente apenas em fragmentos. Dessa maneira, uma vacina possui os antígenos capazes de estimular no 
organismo humano a produção de anticorpos ao simular uma doença infecciosa, garantindo assim a imunização 
contra a doença.
Com base nas informações do texto, pode-se concluir corretamente que","os profissionais da área médica, que atuam no desenvolvimento de vacinas, desenvolvem imunidade a determinadas 
doenças e, por isso, não se contaminam, nem transmitem os agentes causadores da doença para seus pacientes","as vacinas, que são aprovadas pelas agências reguladoras, podem ser produzidas e aplicadas na população a fim 
de atuarem na prevenção das doenças através de anticorpos específicos produzidos pelo organismo humano","a pandemia pode ser definida como a concentração de casos de uma mesma doença em um determinado local sem 
provocar o alastramento em outras regiões","as vacinas possuem os anticorpos obtidos a partir dos agentes causadores da doença e são eficazes no tratamento 
dos pacientes contaminados","a vacina específica para Covid–19 demorou muito tempo para ser produzida, pois a bactéria causadora da doença 
era totalmente desconhecida",Vestibulinho 1SEM2022,B
24,"TEXTO 1
Na Idade Média (476 a 1453), tanto a infância quanto a adolescência não eram reconhecidas como fases 
do desenvolvimento humano. No período de transição para a vida adulta, as maiores preocupações da comunidade 
eram a castidade e o casamento. Esse período não aparentava ser fonte de maiores preocupações: “os filhos 
de artesãos seguiriam artesãos, os pertencentes à aristocracia feudal se encaminhavam para a vida militar 
ou religiosa e o camponês seguiria camponês”.
TEXTO 2
Segundo a Base Nacional Comum Curricular (BNCC), documento que regulamenta a educação básica no Brasil 
do século XXI, os estudantes devem aprender a valorizar a diversidade de saberes e vivências culturais e 
apropriar-se de conhecimentos e experiências, entender as relações próprias do mundo do trabalho e fazer 
escolhas alinhadas ao exercício da cidadania e ao seu projeto de vida, com liberdade, autonomia, consciência 
crítica e responsabilidade. Os estudantes devem conseguir refletir sobre seus desejos e objetivos, aprendendo 
a se organizar, estabelecer metas, planejar e perseguir com determinação, esforço, autoconfiança e persistência 
seus projetos presentes e futuros.
A análise dos textos nos permite concluir corretamente que","na Idade Média crianças e adolescentes, ao chegarem à vida adulta, desempenhariam as atividades reservadas 
ao seu grupo social; no Brasil do século XXI, os estudantes têm liberdade para fazer escolhas de acordo com seus 
desejos e objetivos","a lei garante que, no Brasil do século XXI, ao alcançar a vida adulta, crianças e adolescentes serão sustentados 
pelos programas sociais do Estado, independente de seu esforço, organização e planejamento pessoal","na Idade Média crianças e adolescentes podiam escolher entre ser militares, camponeses ou artesãos; no Brasil 
do século XXI, os estudantes têm opções de carreira limitadas pela BNCC","crianças e adolescentes, no Brasil do século XXI, assim como na Idade Média, não são reconhecidos e, por isso, 
devem se comportar de acordo com os desejos e objetivos dos adultos","na Idade Média os pais se preocupavam com o futuro de seus filhos, uma vez que era preciso ser artesão 
ou camponês para pertencer à aristocracia feudal",Vestibulinho 1SEM2022,A
25,"Comer bem não é comer muito, mas ter uma dieta equilibrada, que atenda às necessidades do corpo e ajude a manter 
a saúde, reduzindo o risco de várias doenças, como recomendam os nutricionistas e os técnicos em nutrição.
Com relação aos tipos de alimentos, às orientações e aos problemas nutricionais, assinale o que for correto.","Na promoção da alimentação saudável para diminuição de casos de obesidade e hipertensão, deve-se incentivar 
o consumo de alimentos industrializados e gordurosos na dieta da população","A celulose presente nas fibras de alimentos como grãos, verduras, legumes e frutas não é digerida pelo organismo 
humano, não fornece calorias, mas estimula o trânsito intestinal","Uma alimentação adequada apresenta grande consumo de frutas e outros vegetais, bem como a alta ingestão 
de gorduras saturadas, sal e carboidratos","O rótulo do alimento que contém a classificação Zero Lactose informa que esse alimento não tem valor calórico 
e é indicado para pacientes diabéticos","Os alimentos como arroz, macarrão e batatas devem ser retirados da dieta, pois não fornecem nenhuma vantagem 
ao organismo",Vestibulinho 1SEM2022,B
