question_number,statement,question_a,question_b,question_c,question_d,question_e,source,answer
26,"Suponha que, na construção de um trecho de 1 km de ferrovia no Brasil, uma empresa distribuiu os dormentes 
de forma que:
• 25 % sejam do tipo roliço;
• 30 % sejam do tipo semi-roliço;
• 35 % sejam do tipo de duas faces;
• e o restante sejam do tipo prismático.
Diante dessas condições, é correto afirmar que
2
1","a razão entre a quantidade de dormentes do tipo roliço e do tipo prismático, nessa ordem, é igual a",a soma das porcentagens dos dormentes semi-roliços e prismáticos é igual a 35 %,300 metros da ferrovia serão compostos por dormentes do tipo prismático,a diferença percentual entre os dormentes de duas faces e prismáticos é de 5 %,"a razão entre a quantidade de dormentes do tipo de duas faces e do tipo semi-roliço, nessa ordem, 
é igual a .
7
6",Vestibulinho 1SEM2025,E
27,"Para a população camponesa da Idade Média, as mulheres reconhecidas como “bruxas” eram membros 
fundamentais da comunidade. Elas eram normalmente mais velhas, acumulavam anos de experiência e 
dominavam os saberes necessários para lidar com a vida e a morte: as plantas que curavam doenças, que 
auxiliavam os partos ou que causavam alívio no processo de falecimento. Como define o historiador francês 
Jules Michelet (1798 –1874): “a elas se pedia a vida, a morte, remédios, venenos”.
Durante dez séculos, a Igreja Católica tolerou práticas consideradas pagãs em toda a Europa. Porém, 
entre o final do século XIV e a primeira metade do século XV, passou a reprimir tudo o que contrariasse os 
dogmas cristãos.
Esse período foi caracterizado pela","consolidação do Iluminismo, movimento intelectual cristão que valorizava a razão, considerada a 
única forma de garantir o progresso da humanidade, em detrimento da fé e do poder dos reis","intensificação dos fluxos de capitais, mercadorias, pessoas e informações, devido ao avanço 
técnico na comunicação e nos transportes, o que consolidou o poder político dos papas","atuação da Inquisição na investigação e na repressão de práticas contrárias ao catolicismo, bem como na 
perseguição das “bruxas”, mulheres vistas como agentes do demônio na Terra","proclamação das Repúblicas europeias e o início de um período em que todas as crenças religiosas, 
à exceção do cristianismo, foram consideradas primitivas e atrasadas","substituição do trabalho humano por máquinas a vapor, que condenou as mulheres à vida privada 
e ao trabalho doméstico, excluindo-as da vida social",Vestibulinho 1SEM2025,C
28,Assinale a alternativa em que a ação enunciada amenize a vivência no cenário descrito no texto.,"Usar umidificador de ar ou uma bacia com água no ambiente, pois tornam o ambiente mais seco, 
colaborando com o ressecamento da mucosa respiratória","Não beber muita água para evitar a transpiração, bem como fazer refeições leves, pois não se perde 
minerais no suor. E não fazer exercícios físicos entre 10 e 16 horas","Manter ambientes fechados, pois isso ajuda a fazer o ar circular, aumentando a ação de ácaros, 
amigos da saúde respiratória, principalmente de quem já tem predisposição de alguma alergia","Evitar lavar cobertores e casacos, que estavam guardados no armário antes do inverno, para favorecer 
o desenvolvimento de fungos e mofos, benéficos ao sistema respiratório","Cuidar, especialmente de crianças e idosos, que são os mais afetados pela baixa umidade do ar, 
incentivando a ingestão de bastante água, além de sucos naturais",Vestibulinho 1SEM2025,E
29,Intervenções governamentais que poderiam contribuir com a melhora do problema apontado são,"a construção de novas rodovias próximas às áreas de maior incidência de incêndios e a liberação 
de queimadas em áreas de proteção ambiental","a redução da fiscalização para queimadas ilegais e a criação de incentivos fiscais para a expansão 
de pastagens em áreas de floresta","o estímulo ao desmatamento como forma de aumentar a área cultivável e o aumento da exportação 
de produtos agrícolas","a criação de programas de divulgação que abordem a educação ambiental e o incentivo a práticas 
agrícolas sustentáveis","o incentivo ao uso de queimadas como método de limpeza de terrenos e a liberação de agrotóxicos mais 
potentes para combater pragas nas plantações",Vestibulinho 1SEM2025,D
30,"Pamela Isley, conhecida como Hera Venenosa, é uma personagem da DC Comics obcecada por ambientalismo, 
ecologia, botânica e plantas, chegando até mesmo a praticar ativismo terrorista em defesa do meio ambiente. 
Em uma de suas histórias, ao falar sobre o processo de cultivo de agave — planta com a qual se faz a tequila — 
ela aponta que, apesar de esse cultivo ter degradado cada vez mais terras no México, isso não impede que 
vegetarianos, muitas vezes defensores de causas ambientais, comprem o xarope feito a partir dessa planta 
para uso medicinal.
Imagine que você é um(a) consultor(a) de sustentabilidade. Sua missão é ajudar a Hera Venenosa a fazer 
escolhas que sejam verdadeiramente sustentáveis e não violentas, considerando não só o meio ambiente, 
mas também as implicações sociais e éticas dessas escolhas.
Com base nisso, assinale, dentre as alternativas, aquela que seria a melhor orientação para dar a Hera 
Venenosa.","Orientar que ela adote uma abordagem na qual todas as suas ações considerem o equilíbrio entre a 
preservação do meio ambiente e o bem-estar humano, escolhendo cuidadosamente suas batalhas para 
minimizar impactos negativos","Incentivar o uso de plantas exóticas ou transgênicas que crescem rapidamente, sem avaliar os efeitos que 
isso pode ter nos ecossistemas locais","Sugerir que ela continue usando métodos agressivos de ativismo para proteger a natureza, mesmo que 
isso possa prejudicar comunidades humanas","Optar por ações que suscitem a diminuição do consumo de produtos de origem animal, uma vez que 
não é necessário pensar como os produtos vegetais são cultivados e processados, pois eles não 
causam efeitos negativos como o desmatamento","Propor que ela concentre seus esforços em promover o uso de alimentos ultraprocessados, 
visto que não dependem de recursos naturais para serem produzidos e, por isso, auxiliam na preservação 
de plantas e na diminuição da poluição do meio ambiente",Vestibulinho 1SEM2025,A
31,"Durante o Renascimento, houve um aumento de interesse por plantas medicinais. Desse período, data 
o primeiro uso medicinal da dedaleira, da qual, hoje, é obtido um fitofármaco conhecido como digoxina, 
usado no tratamento de insuficiência cardíaca.
Suponha que, nesse período histórico, a eficácia do tratamento com dedaleira, em função das semanas de 
tratamento, pudesse ser estimada pela expressão matemática
E(t) = −2t2 + 15t + 9
em que,
• E(t) é a eficácia do tratamento, em porcentagem; e
• t é o tempo, em semanas, desde o início do tratamento (t ≥ 0).
Assinale a alternativa na qual é apontada a eficácia do tratamento após 6 semanas.",11 %,27 %,43 %,59 %,75 %,Vestibulinho 1SEM2025,B
32,"No estado de Santa Catarina, em algumas escolas rurais, funciona o projeto Casa Familiar Rural, promovido 
pela Secretaria de Estado da Educação em parceria com a Associação das Casas Familiares Rurais. 
Essas escolas recebem principalmente filhos de agricultores que terminaram o Ensino Fundamental II e irão 
cursar o Ensino Médio com Qualificação Técnica em Agricultura. Esses jovens passam uma semana em aula 
na escola e a outra no sítio da família, aplicando o que aprenderam. 
A primeira Casa Familiar Rural foi criada em 1937, na França. A implantação desse modelo foi ideia de algumas 
famílias de agricultores que queriam para os filhos, além da educação formal, um ensino profissionalizante.
Em um determinado dia, a primeira aula é de História, sobre o processo de independência do Brasil. 
A segunda é o dimensionamento de piquetes (área cercada para pastagem animal), depois da qual, na aula 
de matemática, com os números coletados na aula prática, são feitos cálculos que serão usados no dia a dia 
da propriedade. Assim, os alunos vão tomando gosto pelos assuntos da terra.
Com base no texto, é correto afirmar que","as aulas são ministradas nas propriedades rurais das famílias dos alunos para evitar o desperdício 
de dinheiro público na construção de escolas","as escolas, como a Casa Familiar Rural, apesar de ensinar os filhos de agricultores a plantar e a tratar 
de animais, não são reconhecidas pelo governo brasileiro","o modelo educacional Casa Familiar Rural foi criado para ser aplicado na França, inviabilizando sua 
implantação no Brasil, que não detém tecnologias agrícolas avançadas","o ensino profissionalizante implantado pelas escolas rurais impede seus estudantes de ingressarem 
em um curso de nível superior pela ausência de disciplinas obrigatórias","os estudantes, além de adquirir competências e habilidades comuns a qualquer escola brasileira, 
também adquirem conhecimentos relacionados ao seu dia a dia no campo",Vestibulinho 1SEM2025,E
33,"Francisco Alves Mendes Filho, mais conhecido como Chico Mendes, foi um profissional seringueiro. 
Morava na cidade de Xapuri, interior do Acre. Ele era um ativista que lutava pela conservação do 
meio ambiente e defendia uma reforma agrária que tornasse a distribuição de terras mais igualitária. 
Além disso, era, também, fundador de reservas extrativistas não predatórias em seu estado. Com seu 
ativismo em prol da defesa do meio ambiente, começou a criar inimigos em seu entorno. Em 1988, recebeu 
diversas ameaças de morte, mas não parou de lutar por aquilo que acreditava. Em 22 de dezembro 
daquele ano, Chico Mendes foi assassinado na cozinha de sua casa.
Uma das principais atividades inerentes à profissão de Chico Mendes é",distribuir terras na floresta para projetos de plantação de soja e para a pecuária leiteira,"derrubar as seringueiras, que são árvores exóticas, para a implantação de reservas extrativistas","talhar a seringueira para extrair e recolher o látex, que é a matéria-prima da borracha natural","demarcar as terras indígenas para serem utilizadas, posteriormente, em projetos de reforma agrária","organizar sindicatos que permitam o desmatamento da floresta para fomentar o processo de industrialização 
da região",Vestibulinho 1SEM2025,C
34,"A partir do século XVI, a Bacia Amazônica se configurou um cenário de disputas territoriais entre alguns 
países europeus, que se digladiaram pelo domínio da região a fim de se apropriar dos ricos e variados recursos 
naturais ali existentes. A vitória ficou com a Coroa Portuguesa, que intensificou o processo de ocupação territorial 
e exploração das chamadas “drogas do sertão”, produtos da atividade extrativista de alto valor econômico 
na época.
Essas drogas eram",entorpecentes sintéticos vendidos para os Estados Unidos,produtos pecuários utilizados pela população indígena,artefatos semi-industrializados consumidos no Brasil,insumos agrícolas comercializados com o povo Maia,especiarias exportadas para o mercado europeu,Vestibulinho 1SEM2025,E
35,"No equipamento mencionado no texto, a transformação de energia ocorrida que mais contribui para a 
produtividade agrícola é de energia",química para energia cinética,elétrica para energia térmica,química para energia sonora,cinética para energia térmica,luminosa para energia cinética,Vestibulinho 1SEM2025,A
36,"Considerando que a velocidade média de um trator movido a diesel é de 10 km/h, assinale a alternativa que 
apresenta o tempo necessário, em minutos, para que ele percorra o perímetro externo de uma plantação com 
formato quadrado de lado igual a 500 m.",3,12,20,200,250,Vestibulinho 1SEM2025,B
37,"No Peru, colonizadores espanhóis observaram que os povos indígenas tratavam a febre com produtos 
obtidos da casca e das folhas da planta Cinchona ledgeriana (quina amarela). 
Posteriormente, pesquisadores descobriram que essa planta tinha grande eficácia no tratamento da febre 
causada pela malária, um tipo de doença infecciosa. Isso ocorre devido ao fato de o princípio ativo importante 
nesse tratamento, a quinina, quando ingerida, elimina a febre dessa doença por causar a morte do parasita 
da malária.
A respeito dessa doença, pode-se afirmar corretamente que é",transmitida por contato direto de pessoa a pessoa,transmitida pela fêmea infectada do inseto barbeiro,causada pela bactéria parasita do gênero Escherichia,causada pelo protozoário parasita do gênero Trypanosoma,causada pelo protozoário parasita do gênero Plasmodium,Vestibulinho 1SEM2025,E
38,"A importância da mandioca para diferentes povos ao redor do mundo conferiu-lhe o título de alimento 
do século XXI pela Organização das Nações Unidas (ONU), após um esforço para que diversos países 
aumentassem a sua produção.
No Brasil, a mandioca foi produto fundamental também na dieta dos colonizadores europeus, dos navegadores 
e dos africanos escravizados, chegando até os dias atuais.
Sobre essa planta, é correto afirmar que","não tem valor nutricional, sendo utilizada apenas em cultos religiosos como forma de abrir a mente e 
criar visões místicas, devido ao seu potencial alucinógeno","é cultivada há mais de quatro mil anos no território que, atualmente, corresponde ao Brasil, e é considerada 
um alimento sagrado por diferentes povos indígenas","seu consumo está restrito a grupos ribeirinhos tradicionais da Amazônia, uma vez que a planta perdeu 
espaço na mesa dos brasileiros de outras regiões","contém cianeto, uma substância tóxica fatal para humanos e animais e, por isso, sua comercialização 
foi proibida em todo o território nacional","foi introduzida pelos imigrantes árabes, especialmente os libaneses, que chegaram ao país entre o final 
do século XIX e o início do século XX",Vestibulinho 1SEM2025,B
39,"Baseando-se no texto, é correto afirmar que essa planta","provoca intoxicações graves, infecções, alergias e doenças degenerativas que prejudicam a atividade 
intestinal e o metabolismo do corpo","auxilia na contração muscular, além de fortalecer ossos e dentes devido ao fato de ser rica em minerais, 
como cálcio, fósforo e magnésio","dificulta a mobilidade do tubo digestório, prejudicando o peristaltismo intestinal e aumentando a 
constipação ou prisão-de-ventre","possui longas vagens, que, moídas e ingeridas, regulam a função da tireoide e do pâncreas, diminuindo 
os níveis do colesterol bom no sangue","atua purificando águas barrentas, pois suas sementes liberam substâncias que matam os 
micro-organismos parasitas e as larvas dos vermes do ambiente aquático",Vestibulinho 1SEM2025,B
40,"Sobre os nutrientes da planta mencionada no texto, é correto afirmar que","o ferro atua como componente da hemoglobina, pigmento responsável pelo transporte de oxigênio dos 
pulmões aos tecidos do corpo","o potássio regula a quantidade de água no corpo e é essencial para o funcionamento dos olhos, de modo 
que sua escassez gera uma doença chamada escorbuto","a vitamina A atua como anticorpo, defendendo o organismo de micro-organismos parasitas e fortalecendo 
o sistema imunológico humano","o magnésio é essencial para o funcionamento e a produção hormonal da glândula tireoide, além de 
atuar também no aumento da sensibilidade térmica","a vitamina C atua na síntese de proteínas e é produzida pelo corpo humano, de modo que não precisa 
ser ingerida na alimentação",Vestibulinho 1SEM2025,A
41,"Considerando os dados dos elementos químicos encontrados nas folhas da planta moringa, assinale a 
alternativa correta.
Dados:
Ca
Ca
40
20
K
39
19
P
31
15
Mg
Mg
24
12
Fe
Fe
56
26",O cálcio apresenta 20 nêutrons,O ferro apresenta número atômico 56,O potássio apresenta número atômico 15,O elemento de menor número de massa é o fósforo,O elemento com maior número de nêutrons é o magnésio,Vestibulinho 1SEM2025,A
42,"As vitaminas são moléculas que não podem ser sintetizadas pelo organismo humano, dessa forma necessita-se 
da suplementação destes compostos por meio da alimentação.
Podem ser divididas, quanto a sua solubilidade, em duas classes: hidrossolúveis (solúvel em água); 
e lipossolúveis (solúvel em óleo ou gordura).
Para uma vitamina ser hidrossolúvel, ela deve apresentar, em sua estrutura, vários grupos que interajam com a 
água, como os grupos hidroxilas (O–H), que devem estar bem espalhados em toda sua estrutura.",,,,,,Vestibulinho 1SEM2025,C
43,"As atividades ligadas à cana-de-açúcar praticamente definiram a economia colonial. A vida cotidiana girava 
em torno dos engenhos e do modo de viver que emanavam, por isso os vínculos sociais foram se definindo 
nesses espaços, nos quais público e privado se misturavam, e os quais agregavam colonizadores, colonos 
e colonizados em torno das relações de trabalho.
A produção de açúcar no Brasil colonial se baseou em três características que definiram as estruturas de nossa 
sociedade até a atualidade.
Essas características são","diversificação de culturas, reforma agrária e mão de obra assalariada","rotação trienal de cultivos, feudalismo e mão de obra servil","monocultura, latifúndio e mão de obra escravizada","sistema agroflorestal, agricultura familiar e mão de obra livre","produção orgânica, propriedade coletiva da terra e trabalho voluntário",Vestibulinho 1SEM2025,C
44,"O papiro foi uma planta de grande importância para os egípcios, uma vez que era abundante em seu território. 
A planta era utilizada tanto para a confecção de cordas, como para a construção de barcos.
Os egípcios antigos também utilizavam partes dessa planta para",fabricar uma arma que garantiu sua hegemonia no norte da África,construir os canais que desviavam a água do rio Nilo para as suas plantações de trigo,produzir o material fino e resistente que foi utilizado como suporte para a sua escrita,criar os pigmentos utilizados na concepção de maquiagem para os olhos e os lábios,compor unguentos e pomadas utilizadas no tratamento de doenças de pele,Vestibulinho 1SEM2025,C
45,"Quando o agricultor suíço Ernest Götsch comprou sua fazenda na Bahia, nos anos 1980, quase todos os 
510 hectares da propriedade haviam sido desmatados, e os animais silvestres eram raros. Os donos 
anteriores passaram anos criando porcos e cultivando mandioca de forma convencional, o que esgotou 
o solo e assoreou 14 riachos que cruzavam a fazenda. “Dentro de pouco menos de dois anos, eu tinha 
reflorestado tudo”, conta o suíço, que também viu todos os riachos renascerem no processo.
Hoje a maior parte da propriedade virou uma reserva ambiental privada, e somente 5 hectares — menos 
de 1 % do terreno — lhe geram receitas. É nessa área que, em meio a grande variedade de frutas, legumes 
e árvores imensas, ele cultiva um cacau de alto valor, exportado para Portugal.
A partir da leitura do texto, é correto afirmar que",investir em áreas desmatadas não gera lucros e receitas,preservar o meio ambiente impede a produção de alimentos,criar porcos e cultivar mandioca de forma convencional ajuda a reflorestar áreas degradadas,investir na melhora do bem-estar da população necessariamente provoca danos ao meio ambiente,preservar o meio ambiente pode gerar renda e desenvolvimento econômico,Vestibulinho 1SEM2025,E
46,"Pronomes são importantes elementos de coesão textual e têm a função de retomar ou antecipar informações 
com as quais eles estabelecem uma referência. 
Analisando os pronomes em destaque no texto, é correto afirmar que",I e II se referem ao termo “culinária”,"II, III e IV se referem ao termo “florestas”",IV e V se referem à expressão “variante domesticada”,"VI e VII se referem, respectivamente, a “frutas” e “pré-colombianos”","VIII e IX se referem, respectivamente, a “frutos” e “povos indígenas”",Vestibulinho 1SEM2025,E
47,"Sobre as informações presentes no texto, é correto afirmar que","houve interferência humana nas florestas primárias, pois os guias locais encontraram tanto cupuaçu 
quanto cupuí nessas áreas","a interferência esporádica dos povos originários da Amazônia na natureza acarretou o surgimento de novas 
espécies, como o cupuí e o cupuaçu","houve duas etapas no processo de domesticação do cupuaçu: a primeira, datada entre 5 e 8 mil anos 
atrás; a segunda, há cerca de 200 anos","as civilizações pré-colombianas se apropriaram dos estudos de Darwin para desenvolver frutas e grãos 
mais adaptados ao meio em que se encontravam","os povos originários já utilizavam técnicas complexas de manejo agrícola, como a modificação genética e 
o desmatamento, para ampliar a produção de alimentos",Vestibulinho 1SEM2025,C
48,Assinale a alternativa na qual o elemento coesivo em destaque contribui para expressar uma hipótese.,"“Entre 5 e 8 mil anos atrás, o cupuaçu estava sendo desenvolvido na região do médio-alto Rio Negro.”",“...ela não surgiu da evolução natural da floresta: foi obra da mão humana.”,"“Os indígenas que viviam na região milhares de anos antes da colonização portuguesa empregaram 
técnicas de domesticação de plantas para criá-la.”","“Se o cupuaçu não nascia ‘naturalmente’ em áreas de fraca interferência humana, era razoável supor que 
ele seria uma variante domesticada do cupuí...”","“Antes da colonização, a Amazônia foi um centro de domesticação e modificação de espécies selvagens.”",Vestibulinho 1SEM2025,D
49,"No segundo parágrafo, os travessões em “– os guias locais da região amazônica –” destacam trecho que se 
refere aos mateiros, apresentando uma",contradição,explicação,retificação,enumeração,advertência,Vestibulinho 1SEM2025,B
50,"cresci feito árvore torta 
numa horta 
que não deveria ter dado espaço para mim. 
cresci perdendo folhas, 
alcancei o sol cedo demais, 
queimei a ponta dos meus galhos, 
e choro junto ao céu em dias de chuva 
pra ninguém perceber. 
crescer é um pouco de se adaptar 
com se aceitar. 
é um pouco injusto, 
mas é necessário. 
minhas raízes me empurram pro céu, 
sou árvore que queria ser estrela.
João Doederlein – @AKAPOETA
Depreende-se do poema que o processo de crescimento pressupõe",reconhecer que esse processo é justo por exigir subserviência e aceitação,conciliar a aceitação de si mesmo com a necessidade de ser resiliente diante dos problemas enfrentados,expor sem receios os sofrimentos a fim de depender do apoio das pessoas com quem se convive,acelerar o processo de evolução por meio da busca constante pelo sucesso a qualquer custo,"resignar-se a viver de maneira limitada, mesmo que haja condições propícias ao desenvolvimento.
Exame: 15/12/2024 
15/12/2024 
(domingo), às 13h30
Vestibulinho
Vestibulinho
1 o SEM/2025
 SEM/2025
FOLHA DE RESPOSTAS INTERMEDIÁRIAS
FOLHA DE RESPOSTAS INTERMEDIÁRIAS
Prezado(a) candidato(a),
Prezado(a) candidato(a),
1.1. Responda a todas as questões contidas neste caderno e, se desejar, transcreva as alternativas 
 Responda a todas as questões contidas neste caderno e, se desejar, transcreva as alternativas
assinaladas para esta Folha de Respostas Intermediária.
assinaladas para esta Folha de Respostas Intermediária.
2.2. Não deixe questões em branco.
 Não deixe questões em branco.
3.3. Marque com cuidado e assinale apenas uma resposta para cada questão.
 Marque com cuidado e assinale apenas uma resposta para cada questão.
4.
4. Transcreva todas as alternativas para a Folha de Respostas Definitiva, utilizando
 Transcreva todas as alternativas para a Folha de Respostas Definitiva, utilizando caneta esferográfica de 
 caneta esferográfica de 
tinta preta ou azul
tinta preta ou azul, conforme o modelo a seguir:
, conforme o modelo a seguir:
A
B
D
E
PROVA (50 RESPOSTAS)
PROVA (50 RESPOSTAS)
RESPOSTAS de 31 a 45
RESPOSTAS de 46 a 50
RESPOSTAS de 01 a 15
RESPOSTAS de 16 a 30
01
31
16
46
A
C
B
D
E
A
C
B
D
E
A
C
B
D
E
A
C
B
D
E
02
32
17
47
A
C
B
D
E
A
C
B
D
E
A
C
B
D
E
A
C
B
D
E
03
33
18
48
A
C
B
D
E
A
C
B
D
E
A
C
B
D
E
A
C
B
D
E
04
34
19
49
A
C
B
D
E
A
C
B
D
E
A
C
B
D
E
A
C
B
D
E
05
35
20
50
A
C
B
D
E
A
C
B
D
E
A
C
B
D
E
A
C
B
D
E
06
36
21
A
C
B
D
E
A
C
B
D
E
A
C
B
D
E
07
37
22
A
C
B
D
E
A
C
B
D
E
A
C
B
D
E
08
38
23
A
C
B
D
E
A
C
B
D
E
A
C
B
D
E
09
39
24
A
C
B
D
E
A
C
B
D
E
A
C
B
D
E
10
40
25
A
C
B
D
E
A
C
B
D
E
A
C
B
D
E
11
41
26
A
C
B
D
E
A
C
B
D
E
A
C
B
D
E
12
42
27
A
C
B
D
E
A
C
B
D
E
A
C
B
D
E
13
43
28
A
C
B
D
E
A
C
B
D
E
A
C
B
D
E
14
44
29
A
C
B
D
E
A
C
B
D
E
A
C
B
D
E
15
45
30
A
C
B
D
E
A
C
B
D
E
A
C
B
D
E",Vestibulinho 1SEM2025,B
